{
  "schema_id": "peepshow.authoring.state_scene",
  "schema_version": 2,
  "scene_id": "lobby",
  "display_name": "Lobby",
  "scene_type": "STATE_SCENE",
  "entry_state": "idle",
  "variables": [],
  "input_actions": [
    { "action_id": "button_a_press", "logical_source": "BUTTON_A", "event_kind": "press" }
  ],
  "scene_exits": [
    { "scene_exit_id": "to_garden", "display_name": "Garden", "target_scene": "garden" }
  ],
  "routes": [
    {
      "route_id": "idle_button_a_press",
      "action_ref": "button_a_press",
      "from_states": ["idle"],
      "guards": [],
      "actions": [],
      "scene_exit_ref": "to_garden",
      "target_scene": "garden"
    }
  ],
  "reactive_wait_default": {
    "policy_id": "lobby_wait_policy",
    "hold_fallback_allowed": true,
    "event_interests": ["button_a_press"]
  },
  "interaction_policy": {
    "policy_id": "lobby_interaction",
    "mode": "continuous",
    "meaningful_activity_actions": ["button_a_press"]
  },
  "objects": [
    {
      "object_id": "border", "kind": "outline_rect", "width": 160, "height": 136,
      "z_order": 0, "layer": "SCENE", "defaults": { "x": 4, "y": 4, "visible": true }
    },
    {
      "object_id": "title", "kind": "sprite", "width": 80, "height": 16,
      "z_order": 1, "layer": "SCENE",
      "defaults": { "x": 44, "y": 28, "visible": true, "visual_ref": "lobby_title.frame" }
    },
    {
      "object_id": "navigation", "kind": "sprite", "width": 120, "height": 8,
      "z_order": 1, "layer": "SCENE",
      "defaults": { "x": 24, "y": 76, "visible": true, "visual_ref": "lobby_navigation.frame" }
    }
  ],
  "states": [
    { "state_id": "idle", "display_name": "Lobby", "object_overrides": [] }
  ]
}
