{
  "schema_id":"peepshow.authoring.state_scene","schema_version":2,"scene_id":"settings","display_name":"Settings","scene_type":"STATE_SCENE","entry_state":"shown",
  "variables":[],"input_actions":[{"action_id":"back_to_menu","logical_source":"BUTTON_B","event_kind":"press"}],
  "scene_exits":[{"scene_exit_id":"to_main_menu","display_name":"Main Menu","target_scene":"main"}],
  "routes":[{"route_id":"back_to_menu","action_ref":"back_to_menu","from_states":["shown"],"guards":[],"actions":[],"scene_exit_ref":"to_main_menu","target_scene":"main"}],
  "reactive_wait_default":{"policy_id":"settings_wait","hold_fallback_allowed":true,"event_interests":["back_to_menu"]},
  "interaction_policy":{"policy_id":"settings_interaction","mode":"continuous","meaningful_activity_actions":["back_to_menu"]},
  "objects":[
    {"object_id":"border","display_name":"Scene border","kind":"outline_rect","width":160,"height":136,"z_order":0,"layer":"SCENE","defaults":{"x":4,"y":4,"visible":true}},
    {"object_id":"title","display_name":"Settings title","kind":"text","text":"SETTINGS","font_id":"peepshow.system.8x8.basic.v1","scale":2,"alignment":"center","width":160,"height":16,"z_order":1,"layer":"UI","defaults":{"x":4,"y":44,"visible":true}},
    {"object_id":"body","display_name":"Settings message","kind":"text","text":"Project preferences","font_id":"peepshow.system.8x8.basic.v1","scale":1,"alignment":"center","width":160,"height":8,"z_order":1,"layer":"UI","defaults":{"x":4,"y":76,"visible":true}},
    {"object_id":"back","display_name":"Back hint","kind":"text","text":"B: MENU","font_id":"peepshow.system.8x8.basic.v1","scale":1,"alignment":"center","width":160,"height":8,"z_order":1,"layer":"UI","defaults":{"x":4,"y":116,"visible":true}}
  ],
  "states":[{"state_id":"shown","display_name":"Settings","object_overrides":[]}],"event_bindings":[],"event_handlers":[]
}
